horotitle1,horodate1,dis
Aries,2020-02-12,"During this week, your main focus will be on your creative energies. The full moon will be bringing some completions in the creative projects. You will have concerns regarding teamwork as well. This is a very sensitive time for your team relations, so, you have to take care of your team members. Stay away from unhealthy communications. You will have to be careful with your ventures as well. This is not a great time to invest in risky ventures too. Children and youngsters will need more attention. However, you will be attending social gatherings and networking events as well.Aries horoscope today - February 12, Wednesday →Mars will be entering into the earth sign of Capricorn and that will bring multiple opportunities for taking up new challenges at work. Mars indicates challenges and it likes to be in the sign of Capricorn. So, you can easily assume that you will be getting more responsibilities at work. Those responsibilities will be very challenging. Mars is very forceful in the sign of Capricorn and that shows, you have to control your ego and emotions at work. You will have very serious discussions with your managers and colleagues. Workload and stress are also seen, but there will be good opportunities as well."
Taurus,2020-02-12,"Your major focus will be at home and personal life as there will be a full moon in that sector. The full moon indicates perfections or endings. During this week, you will find some solutions for certain issues at home. The Moon indicates emotions, so there will be a lot of emotional dramas regarding your private and family life. You should be very careful with the elderly female figures in the family as they can have multiple concerns. It can be emotional, physical or spiritual concerns. You need to support them, and they need that during this time. Real estate deals and plans for the house renovation can also come up. This is also a week to discuss family matters with your relatives.Taurus horoscope today - February 12, Wednesday →You are thinking about a long trip for the last few days. There are a lot of opportunities to go for a long trip or foreign travel, within the next 45 days of this week. Mars will be entering the earth sign of Capricorn and that will bring up the opportunities for foreign travels. This is a good time to take up a new certification program, but there can be some challenges as well. Foreign collaborations are very much possible during this week. However, you should stay away from all kinds of debates regarding religion and philosophy."
Gemini,2020-02-12,"The possibility of transfer does exist during this week because, the full moon will grace the sign of Leo, which rules the house of travel. You were expecting some traveling opportunities for the last few days and during this week those plans will get materialized. The full moon indicates completions, and those completions can be in your relationship with siblings too. You will have serious as well as emotional communication with your siblings. They will have more demands and that will be slightly challenging for you. You have to complete some projects from communication, media, teaching or preaching. This is also a big-time for counselors as well. You will try to start a new venture or complete a process regarding a venture.Gemini horoscope today - February 12, Wednesday →You have to be careful with your finances for the next 45 days as the planet of clashes, Mars will be entering the sign of Capricorn and it will become very forceful. During this week, you may have to spend money, but gains can also come up. However, this is a risky time for financial matters, so you have to be careful with your financial transactions. Please avoid the chances of lending and borrowing, but if it is inevitable, then you should take expert advice. Arguments with partners can also come up."
Cancer,2020-02-12,"This is a very sensitive week for your finances as the full moon will rise in the 2nd house for finances. The full moon indicates sensitivity and endings, so you have to be very careful with your finances. This is not the time to spend as there can be some expenses on your way. Try to avoid complicated financial plans. At the same time, there will be some changes at work and family as well. At work, you will have to complete some projects. Arguments can also be a part of this week so, you should control your emotions. The full moon indicates too much of emotions regarding the family as well as work.Cancer horoscope today - February 12, Wednesday →Personal and professional relationships will be facing some challenges. Mars is very forceful for the next 45 days. This planet will be entering the earth's sign of Capricorn and that can make your spouse or partner little aggressive. They will have more demands and that will be influencing you as well. You will have to argue with them but try to be on a safe side. Don’t try to offend them. New contracts and relationships can also come up. There will be a lot of opportunities to mingle with new people."
Leo,2020-02-12,"Your personal life will be very much active as the full moon is going to enlighten you. The full moon indicates completions and endings. You will be ending some projects during this time. There will be certain endings in personal as well as professional life. It can be like a fresh start for certain events. However, you can be emotional about certain things, so don’t get into any complex deals. Please be flexible with your spouse and in the professional sector as well. You can be anxious regarding your professional and personal life, but there is no point in getting anxious. Try to be calm and spend some time in meditation.Leo horoscope today - February 12, Wednesday →Mars will be entering the sign of Capricorn and that will be triggering your workplace and colleagues. Mars is good at Capricorn, so you can expect some changes in the workplace. It can be a new workplace and new colleagues. There can be a new beginning regarding your work. However, these beginnings may not be easy, so you have to take careful steps. Discussions with colleagues can turn into arguments. There will be some complex projects and that can be very much energy-draining as well. There can be minor physical issues as well."
Virgo,2020-02-12,"The full moon will be rising in the sign of Leo and for you that will trigger your emotions. You are going through emotional issues and that can end during this week. However, you should stay away from all complex matters as your subconscious mind is negatively triggered. Minor physical issues can also come up and you need to take enough rest. You will have to take some time out for yourself and that should spend in prayer and meditation. This is not a good time to come out and socialize. Work and finance-related challenges can also come up. You will be thinking about your past and that will help you to do a better analysis of your future.Virgo horoscope today - February 12, Wednesday →Mars will enter the sign of Capricorn and that will trigger your creative energies. This move will be making you active regarding creative projects. Those who work with own ventures will be getting more opportunities. You should be very careful when you invest in risky ventures. Mars in the sign of Capricorn is very strong and that will make you very stubborn. This stubbornness can bring arguments and thus you can get into wrong plans as well. Social gatherings and entertainment programs can also come up. This is also an important time for working with children and youngsters."
Libra,2020-02-12,"The full moon will be shining in your long-term goals and plans. This indicates completions in long-term projects. The full moon always indicates sensitive matters, so you have to be careful with your long-term plans. They will get completed and you will have to be careful regarding the discussion in these projects. You were expecting a new long-term plan regarding finances and that also will get materialized. However, you will have some challenges from your long-term relationships as well. There will be complexities in such relationships. You will be working for large groups. Projects from the technical and finance sector can also come up.Libra horoscope today - February 12, Wednesday →The full moon will be shining in your long-term goals and plans. This indicates completions in long-term projects. The full moon always indicates sensitive matters, so you have to be careful with your long-term plans. They will get completed and you will have to be careful regarding the discussion in these projects. You were expecting a new long-term plan regarding finances and that also will get materialized. However, you will have some challenges from your long-term relationships as well. There will be complexities in such relationships. You will be working for large groups. Projects from the technical and finance sector can also come up."
Scorpio,2020-02-12,"The full moon will be bringing some completions at work. The full moon always indicates completion and that can be in many things connected with work as well as family. The full moon means sensitiveness and at work, you may have to go through some complexities. You have to complete some projects and that can be stressful. So, don’t try to take any risk or don’t waste your time at work. Your managers can have more expectations from your work and you have to meet that. That cannot be easy as well, so you should skill in a better way. Those who work in the medical and customer care sector can have more opportunities during this week.Scorpio horoscope today - February 12, Wednesday →There will be a lot of short travels from this week onwards as Mars will be entering its favorite sign, Capricorn and that will be a big opportunity for you. That opportunity can come from short projects and travels as well. This is a time to work hard for your ventures and you will be getting benefits too. This is not a great time for your finances. There will be some financial transactions too. Projects from media and teaching can also come up. However, this is a week for multitasking and you can get minor physical issues."
Sagittarius,2020-02-12,"The full moon will rise during this week and that will make you more spiritual. There will be some projects from far places. During this week, you will be completing some projects from media and publishing. This is also a week to interact with people from foreign lands. The full moon indicates completions and endings, so you will have to complete some projects. Students will have a complex time and they may find it difficult to focus, so they have to work hard. This is also a week to attend some training programs too. Traveling is also possible during this week.Sagittarius horoscope today - February 12, Wednesday →Mars will be entering into the earth sign of Capricorn and that will be influencing your finances. Multiple financial needs can arise and you should be prepared for that. Unexpected expenses also can come up, so you should cut off your expenses. This is a very complex time for your finances, but there will be some opportunities for a part-time job as well. So, you should use this opportunity very carefully. However, there will be arguments regarding your family matters. At work, there can be changes and you will have to take up a lot of responsibilities. This is a complex time and you should control your ego."
Capricorn,2020-02-12,"You have to be very careful during this week as it comes with a negative shade to you. This is due to the full moon in the sign of Leo, which is going to influence your finances and partnerships. The full moon shows fluctuations, during this entire month, there will be concerns regarding finances. You should not take any risk and somehow save money. Otherwise, you will have a lot of expenses and financial needs. I don’t want to discourage you, but I am cautioning you regarding this sensitive matter. In emotional relationships, you will take up important decisions either to quit or continue.Capricorn horoscope today - February 12, Wednesday →For the next 45 days, Mars will be entering the sign of Capricorn and that will be acting for as well as against you. Mars is the planet for arguments and struggles. There will be multiple opportunities for growth, but you will have to struggle. There will be new responsibilities coming up and you will have to make a lot of effort to work in it. There will be new people coming to you, but you need to stay away from arguments. Physical issues can come up as Mars is intense energy. You need to have a lot of rest."
Aquarius,2020-02-12,"Your 7th house of spouse and professional relationships will be greatly triggered during this week. All these matters will be influenced by the powerful full moon in the royal sign of Leo and that indicates perfections or completions in your relationships. The moon indicates volatility and sensitiveness, so there will be some challenges regarding your relationships. Try to be practical while you deal with your partner. They can have multiple needs and you should not avoid them. Let them speak and please listen to them carefully. In business deals, you will complete some formalities as well. However, don’t be in a haste to take up any decisions.Aquarius horoscope today - February 12, Wednesday →For the next few weeks, you can have a lot of emotional needs as Mars will enter the sector for your subconscious mind. It will bring more energy into your thoughts and that should be controlled. Otherwise, you will be arguing with many people. Minor physical issues can also come up. At work also you will have to go through some challenges and try to control your ego. During these days, you will be arguing with your colleagues. Please don’t be in a haste to take up new job offers. You should think multiple times before that."
Pisces,2020-02-12,"The full moon will shine on your workplace and that doesn’t mean its all bad. However, there will be challenges from your workplace. Work pressure will be there to complete the projects on time, but your health can be a concern. Try to take enough medication and rest. Please try to avoid emotional scenes at work, otherwise, that may act against you. There can be practical difficulties in having unity at work also. The full moon indicates perfection, so, you will be completing some formality at work too. There will be team discussions and new plans for your work. Try to be calm and don’t get into any petty talks at work.Pisces horoscope today - February 12, Wednesday →Mars will be entering Capricorn and that will be triggering your long term relationships and gains. This is showing many changes regarding your long term relationships. Mars means arguments too, so there are chances for arguments with your teammates. They will have much expectation regarding your work, and you may try to dominate them. New teammates can also come up during this phase. There will be new projects from the technology and finance sectors. Projects with international groups can also come up. This is a busy week and you may join new teams."
